{
  "conversationID": "channel-1",
  "messageID": "message-1",
  "senderID": "user-1",
  "replyTargetID": "message-1",
  "prompt": "Summarize this document",
  "inputParts": [
    {
      "type": "file",
      "file": {
        "path": "tmp/report/input.pdf",
        "filename": "input.pdf",
        "contentType": "application/pdf",
        "sizeBytes": 4096
      }
    }
  ],
  "responseLanguage": "ko",
  "context": {
    "messages": [
      {
        "speaker": "김여명",
        "text": "지난 대화",
        "sentAt": "2026-07-14T00:00:00Z"
      }
    ],
    "hasMoreBefore": false,
    "historyCursor": "cursor-1",
    "conversationType": "channel",
    "channelID": "channel-1",
    "channelName": "general",
    "addressing": {
      "botMentioned": true
    }
  },
  "legacyFields": {
    "sourceEventID": "event-1"
  }
}
